{
  "revision": 1,
  "feedback_id": "00000065-0000-4000-8000-000000000065",
  "study_session_id": "00000066-0000-4000-8000-000000000066",
  "study_version": 3,
  "lesson_run_id": "00000067-0000-4000-8000-000000000067",
  "lesson_run_version": 3,
  "question_id": "00000068-0000-4000-8000-000000000068",
  "input_id": "00000069-0000-4000-8000-000000000069",
  "attempt_id": "0000006a-0000-4000-8000-00000000006a",
  "lesson": {
    "concepts": [
      "A queue preserves insertion order.",
      "Removing an item changes the front.",
      "An empty queue has no front item."
    ],
    "questions": [
      {
        "id": "00000068-0000-4000-8000-000000000068",
        "text": "Which item leaves a queue first?"
      },
      {
        "id": "0000006b-0000-4000-8000-00000000006b",
        "text": "What should a caller check before removal?"
      }
    ]
  },
  "answer": {
    "source_kind": "OWNER_STUDY_ANSWER_INPUT",
    "role": "USER",
    "trust": "USER_DIRECT",
    "text": "The earliest item leaves first. Check that the queue has an item."
  }
}
